{
  "workflow_id": "wf-009-shared-data-model",
  "backlog_item_id": "BI-009",
  "stages": [
    {
      "stage_name": "define",
      "hero": "muti-mind",
      "status": "completed",
      "artifacts_produced": ["backlog-item"],
      "started_at": "2026-03-20T09:00:00Z",
      "completed_at": "2026-03-20T10:00:00Z"
    },
    {
      "stage_name": "implement",
      "hero": "cobalt-crush",
      "status": "completed",
      "artifacts_consumed": ["backlog-item"],
      "started_at": "2026-03-20T10:00:00Z",
      "completed_at": "2026-03-21T08:00:00Z"
    },
    {
      "stage_name": "validate",
      "hero": "gaze",
      "status": "completed",
      "artifacts_produced": ["quality-report"],
      "started_at": "2026-03-21T08:00:00Z",
      "completed_at": "2026-03-21T08:30:00Z"
    },
    {
      "stage_name": "review",
      "hero": "the-divisor",
      "status": "completed",
      "artifacts_produced": ["review-verdict"],
      "artifacts_consumed": ["quality-report"],
      "started_at": "2026-03-21T08:30:00Z",
      "completed_at": "2026-03-21T09:00:00Z"
    },
    {
      "stage_name": "accept",
      "hero": "muti-mind",
      "status": "completed",
      "artifacts_produced": ["acceptance-decision"],
      "artifacts_consumed": ["review-verdict", "quality-report"],
      "started_at": "2026-03-21T09:00:00Z",
      "completed_at": "2026-03-21T09:15:00Z"
    },
    {
      "stage_name": "measure",
      "hero": "mx-f",
      "status": "completed",
      "artifacts_produced": ["metrics-snapshot"],
      "started_at": "2026-03-21T09:15:00Z",
      "completed_at": "2026-03-21T09:30:00Z"
    }
  ],
  "artifacts": [
    "backlog-item",
    "quality-report",
    "review-verdict",
    "acceptance-decision",
    "metrics-snapshot"
  ],
  "decisions": [
    {
      "type": "review",
      "hero": "the-divisor",
      "result": "APPROVED",
      "rationale": "All personas approved. No critical findings.",
      "iteration": 1,
      "timestamp": "2026-03-21T09:00:00Z"
    },
    {
      "type": "acceptance",
      "hero": "muti-mind",
      "result": "accept",
      "rationale": "All acceptance criteria met.",
      "iteration": 1,
      "timestamp": "2026-03-21T09:15:00Z"
    }
  ],
  "total_elapsed_time": "24h30m",
  "outcome": "shipped"
}
